<stylesheet-descriptor
    xmlns="https://source.jasig.org/schemas/uportal/io/stylesheet-descriptor" 
    xmlns:xsi="http://www.w3.org/2001/XMLSchema-instance"
    xsi:schemaLocation="https://source.jasig.org/schemas/uportal/io/stylesheet-descriptor ../../../resources/xsd/io/stylesheet-descriptor/stylesheet-descriptor-4.0.xsd"
   
    version="4.0"
>
    <name>UniversalityAndroid</name>
    <description>Renders DLMTabsColumns as xhtml for a mobile device</description>
    <uri>classpath:/layout/theme/muniversality/muniversality.xsl</uri>
    <stylesheet-parameter>
        <name>minimizePortletsDefault</name>
        <default-value>true</default-value>
        <scope>REQUEST</scope>
        <description>Overloading the use of the stylesheet parameters to denote that portlets should render minimized by default for this stylesheet</description>
    </stylesheet-parameter>
    <stylesheet-parameter>
      <name>skin</name>
      <default-value>android</default-value>
      <scope>PERSISTENT</scope>
      <description>Skin name</description>
    </stylesheet-parameter>
</stylesheet-descriptor>