<stylesheet-descriptor
    xmlns="https://source.jasig.org/schemas/uportal/io/stylesheet-descriptor" 
    xmlns:xsi="http://www.w3.org/2001/XMLSchema-instance"
    xsi:schemaLocation="https://source.jasig.org/schemas/uportal/io/stylesheet-descriptor ../../../resources/xsd/io/stylesheet-descriptor/stylesheet-descriptor-4.0.xsd"
   
    version="4.0"
>
    <name>DLMXHTML</name>
    <description>Renders DLMTabsColumns as xhtml</description>
    <uri>classpath:/layout/theme/universality/universality.xsl</uri>
    <stylesheet-parameter>
      <name>skin</name>
      <default-value>uportal3</default-value>
      <scope>PERSISTENT</scope>
      <description>Skin name</description>
    </stylesheet-parameter>
</stylesheet-descriptor>